{
	"$schema": "http://json-schema.org/draft-04/schema#",
	"title": "Agency",
	"type": "object",
	"properties": {
		"uid": { "type":  "integer" },
		"agencyId": { "type": "string" },
		"description": { "type": "string" },
		"agencyType": { "type": "string" }
	},
	"required": ["agencyId", "description", "agencyType"]
}
